"107","Dr. Ajit Kr Sharma, (Chemical Engg.), Prof.Ashutosh Sharma, (Chemical Engg.), Prof. Nishith Verma, (Chemical Engg.)","Bi-metal Nanoadsorbents and Methods for Their Preparation and Use","US - 13/482,564","29.05.2012","9809466","07.11.2017"
"106","Dr. Sunil Jha, Project Engineer, Dept. of ME, Dr.J.Ram Kumar Dept. of ME, Mr.Sandeep Nair, M.Tech (Student)","A Device for Magnetic Abrasive Finishing of Multiple Workpieces and Magnetic Abrasive Finishing Process","2309/DEL/2008","06.10.2008","288690","06.10.2017"
"105","Prof. Satyajit Banerjee (Phy), Shyam Mohan, Research Scholar, Physics, Jaivardhan Sinha, Research Scholar, Physics","Systems and Methods for Imaging Characteristics of a Sample and for Identifying Regions of Damage in the Sample","US - 13/878,944","12.03.2014","9778202","03.10.2017"
"104","Mr. Mritunjay Kumar (Student), Mr. Aboobacker Siddique (Student) and Dr. J Ramkumar (ME)","Samaritan (Phototherapy Unit)","287986","03.11.2016","Design","18.09.2017"
"103","Mr. Ashish Mohandas (DP), Mr. Gautham TR (DP), Dr. Koumudi Patil(HSS), Mr.Karthik PB(Student, DP), Ms. Pratiti Sarkar(DP)","2 Shades, a Collaborative/cooperative Board Game(Copyright)","8827/2017-CO/L","30.05.2017","L-68449/2017","09.09.2017"
"102","Mr. Eshan Sadasivan (DP), Prof. Shantanu Bhattacharya (ME), Prof. Mainak Das (BSBE), Prof.Toshib Bagde (DP), Mr. Abhinav Basak (DP)","School Bag Convertible to Study Table","287945","24.10.2016","Design","06.09.2017"
"101","Dr. Sudeep Bhattacharjee, Physics, Mr. Samit Paul, PhD Student, Physics","System and Method for Characterizing Focused Charged Beams","US - 14/397,478","27.10.2014","9733366","15.08.2017"
"100","Mr.Sachin NP (Student), Mr.Ashwin Gandhi (Student)","Electric Mono Wheel Cycle (Z0-E)","284940","04.07.2016","Design","20.06.2017"
"10","Prof. S. Sundar Manoharan, Chem","Magneto-resistive Polymer Composition","934/DEL/2000","13.10.2000","216966","20.03.2008"
"1","Prof. S. Sundar Manoharan (Chem)","A Magneto Conductive Polymer Compositon for Read and Write Head and a Process for Preparation Thereof","US - 09/829,410","09.04.2001","6627101","30.09.2003"